{
  "actor_type": "system",
  "artifact_hash": "sha256:a4d5c8d68348766415d888e371e8aad8bc870958971116349cc01d784bdfdc96",
  "artifact_hashes": [
    "sha256:dd4c3e981c3c30b6f31109e1c41e3977f8010f48862bb9d664a71aefc29fea78",
    "sha256:cfdd404ecb20cdf1db3b1e19831284e4a11307f2aeec63538825d774e7995521"
  ],
  "artifact_id": "EVT-019f8d36-268a-7a4e-9b4f-eadf3955d8b8",
  "created_at": "2026-07-23T04:22:44.106418Z",
  "created_by": {
    "actor_type": "system",
    "host": "research-cli",
    "model_identifier": null
  },
  "event_id": "EVT-019f8d36-268a-7a4e-9b4f-eadf3955d8b8",
  "new_disposition": "human_review_required",
  "new_phase": "independently_reviewed",
  "previous_disposition": "human_review_required",
  "previous_phase": "independently_reviewed",
  "reason": "Full run validation completed",
  "run_id": "RUN-563cd90e-af4d-46fa-9302-f48c030cb398",
  "schema_name": "LifecycleEvent",
  "schema_version": "1.0.0",
  "trigger": "research validate",
  "validation_result": "VAL-019f8d36-2678-7525-87fa-5dee6a81c266"
}
